{
    "id": "A17195429",
    "afile_id": "A17195429_0064",
    "page_index": 64,
    "resources": {
        "full_jpg": "https://dctn4zjpwgdwdiiy5odjv7o2se0bqgjb.lambda-url.us-east-1.on.aws/iiif/3/og-2023-kc-nara_A17195429_0064/full/max/0/default.jpg",
        "ocr_txt": true
    },
    "fields": {
        "sex": {
            "ms_sex_llm_v1": "female"
        },
        "doctype": {
            "ms_doctype_v1": "form"
        },
        "form_title": {
            "ms_form_title_llm_v1": "U.S. Department of Justice Application to File Immigration and Naturalization Service Petition for Naturalization, N-4 115-009"
        },
        "is_g325a": false,
        "is_cert_naturalization": false,
        "countries": {
            "ms_countries_nlp_v1": [
                "China",
                "United States"
            ]
        },
        "years": {
            "ms_years_nlp_v1": [
                1969,
                2023,
                1963,
                1915,
                1978
            ]
        },
        "certificate_naturalization": {
            "complexion": {
                "complexion_llm_v1": null
            },
            "marital_status": {
                "marital_status_llm_v1": null
            },
            "year_naturalization": {
                "year_naturalization_llm_v1": NaN
            },
            "residence_naturlization": {
                "residence_naturlization_llm_v1": null
            }
        },
        "g325a": {
            "occupation": {
                "occupation_llm_v1": null
            },
            "reason": {
                "reason_llm_v1": null
            },
            "nationality": {
                "nationality_llm_v1": null
            }
        }
    }
}