{
    "id": "A42733525",
    "afile_id": "A42733525_0041",
    "page_index": 41,
    "resources": {
        "full_jpg": "https://dctn4zjpwgdwdiiy5odjv7o2se0bqgjb.lambda-url.us-east-1.on.aws/iiif/3/og-2023-kc-nara_A42733525_0041/full/max/0/default.jpg",
        "ocr_txt": true
    },
    "fields": {
        "sex": {
            "ms_sex_llm_v1": "male"
        },
        "doctype": {
            "ms_doctype_v1": "form"
        },
        "form_title": {
            "ms_form_title_llm_v1": "\u5e38\u4f4f\u4eba\u53e3\u767b\u8bb0\u8868, \u67284\u4f9b\u900908 88112"
        },
        "is_g325a": false,
        "is_cert_naturalization": false,
        "countries": {
            "ms_countries_nlp_v1": []
        },
        "years": {
            "ms_years_nlp_v1": [
                2023
            ]
        },
        "certificate_naturalization": {
            "complexion": {
                "complexion_llm_v1": null
            },
            "marital_status": {
                "marital_status_llm_v1": null
            },
            "year_naturalization": {
                "year_naturalization_llm_v1": NaN
            },
            "residence_naturlization": {
                "residence_naturlization_llm_v1": null
            }
        },
        "g325a": {
            "occupation": {
                "occupation_llm_v1": null
            },
            "reason": {
                "reason_llm_v1": null
            },
            "nationality": {
                "nationality_llm_v1": null
            }
        }
    }
}