{
    "id": "A11638538",
    "afile_id": "A11638538_0020",
    "page_index": 20,
    "resources": {
        "full_jpg": "https://dctn4zjpwgdwdiiy5odjv7o2se0bqgjb.lambda-url.us-east-1.on.aws/iiif/3/og-2023-kc-nara_A11638538_0020/full/max/0/default.jpg",
        "ocr_txt": true
    },
    "fields": {
        "sex": {
            "ms_sex_llm_v1": "male"
        },
        "doctype": {
            "ms_doctype_v1": "form"
        },
        "form_title": {
            "ms_form_title_llm_v1": "BIOGRAPHIC INFORMATION, G-325 ( (Rev. 10-1-82) Y"
        },
        "is_g325a": true,
        "is_cert_naturalization": false,
        "countries": {
            "ms_countries_nlp_v1": [
                "Honduras",
                "Belize",
                "United States"
            ]
        },
        "years": {
            "ms_years_nlp_v1": [
                1971,
                1970,
                1956,
                1960,
                1945,
                1987,
                2023,
                1944,
                1978
            ]
        },
        "certificate_naturalization": {
            "complexion": {
                "complexion_llm_v1": null
            },
            "marital_status": {
                "marital_status_llm_v1": null
            },
            "year_naturalization": {
                "year_naturalization_llm_v1": NaN
            },
            "residence_naturlization": {
                "residence_naturlization_llm_v1": null
            }
        },
        "g325a": {
            "occupation": {
                "occupation_llm_v1": "[' retired', 'mechanical eng']"
            },
            "reason": {
                "reason_llm_v1": "NATURALIZATION"
            },
            "nationality": {
                "nationality_llm_v1": "Honduras"
            }
        }
    }
}