{
    "id": "A14635169",
    "afile_id": "A14635169_0023",
    "page_index": 23,
    "resources": {
        "full_jpg": "https://dctn4zjpwgdwdiiy5odjv7o2se0bqgjb.lambda-url.us-east-1.on.aws/iiif/3/og-2023-kc-nara_A14635169_0023/full/max/0/default.jpg",
        "ocr_txt": true
    },
    "fields": {
        "sex": {
            "ms_sex_llm_v1": "male"
        },
        "doctype": {
            "ms_doctype_v1": "form"
        },
        "form_title": {
            "ms_form_title_llm_v1": "Biographic Information, G-325A"
        },
        "is_g325a": true,
        "is_cert_naturalization": false,
        "countries": {
            "ms_countries_nlp_v1": [
                "China",
                "United States"
            ]
        },
        "years": {
            "ms_years_nlp_v1": [
                2023,
                1911,
                1982
            ]
        },
        "certificate_naturalization": {
            "complexion": {
                "complexion_llm_v1": null
            },
            "marital_status": {
                "marital_status_llm_v1": null
            },
            "year_naturalization": {
                "year_naturalization_llm_v1": NaN
            },
            "residence_naturlization": {
                "residence_naturlization_llm_v1": null
            }
        },
        "g325a": {
            "occupation": {
                "occupation_llm_v1": "['n/a']"
            },
            "reason": {
                "reason_llm_v1": "NATURALIZATION"
            },
            "nationality": {
                "nationality_llm_v1": "Chinese"
            }
        }
    }
}