{
    "id": "A19055851",
    "afile_id": "A19055851_0055",
    "page_index": 55,
    "resources": {
        "full_jpg": "https://dctn4zjpwgdwdiiy5odjv7o2se0bqgjb.lambda-url.us-east-1.on.aws/iiif/3/og-2023-kc-nara_A19055851_0055/full/max/0/default.jpg",
        "ocr_txt": true
    },
    "fields": {
        "sex": {
            "ms_sex_llm_v1": "female"
        },
        "doctype": {
            "ms_doctype_v1": "form"
        },
        "form_title": {
            "ms_form_title_llm_v1": "United States Department of Justice Immigration and Naturalization Service, G-325A"
        },
        "is_g325a": true,
        "is_cert_naturalization": false,
        "countries": {
            "ms_countries_nlp_v1": [
                "Canada",
                "United States",
                "Australia",
                "Pakistan",
                "Germany"
            ]
        },
        "years": {
            "ms_years_nlp_v1": [
                1949,
                1969,
                1909,
                1934
            ]
        },
        "certificate_naturalization": {
            "complexion": {
                "complexion_llm_v1": null
            },
            "marital_status": {
                "marital_status_llm_v1": null
            },
            "year_naturalization": {
                "year_naturalization_llm_v1": NaN
            },
            "residence_naturlization": {
                "residence_naturlization_llm_v1": null
            }
        },
        "g325a": {
            "occupation": {
                "occupation_llm_v1": "['butler', ' manager']"
            },
            "reason": {
                "reason_llm_v1": "NATURALIZATION"
            },
            "nationality": {
                "nationality_llm_v1": "So. African"
            }
        }
    }
}