{
    "id": "A18591348",
    "afile_id": "A18591348_0021",
    "page_index": 21,
    "resources": {
        "full_jpg": "https://dctn4zjpwgdwdiiy5odjv7o2se0bqgjb.lambda-url.us-east-1.on.aws/iiif/3/og-2023-kc-nara_A18591348_0021/full/max/0/default.jpg",
        "ocr_txt": true
    },
    "fields": {
        "sex": {
            "ms_sex_llm_v1": null
        },
        "doctype": {
            "ms_doctype_v1": "letter"
        },
        "form_title": {
            "ms_form_title_llm_v1": "U.S. Government Printing Office: 1969 of \u2014337-977"
        },
        "is_g325a": false,
        "is_cert_naturalization": false,
        "countries": {
            "ms_countries_nlp_v1": [
                "Canada",
                "Cuba",
                "Mexico",
                "Dominican Republic",
                "Haiti",
                "Netherlands",
                "United States",
                "Bahamas",
                "Barbados",
                "Bermuda",
                "Jamaica"
            ]
        },
        "years": {
            "ms_years_nlp_v1": [
                1924,
                1969,
                1948,
                1959
            ]
        },
        "certificate_naturalization": {
            "complexion": {
                "complexion_llm_v1": null
            },
            "marital_status": {
                "marital_status_llm_v1": null
            },
            "year_naturalization": {
                "year_naturalization_llm_v1": NaN
            },
            "residence_naturlization": {
                "residence_naturlization_llm_v1": null
            }
        },
        "g325a": {
            "occupation": {
                "occupation_llm_v1": null
            },
            "reason": {
                "reason_llm_v1": null
            },
            "nationality": {
                "nationality_llm_v1": null
            }
        }
    }
}