{
    "id": "A21343567",
    "afile_id": "A21343567_0024",
    "page_index": 24,
    "resources": {
        "full_jpg": "https://dctn4zjpwgdwdiiy5odjv7o2se0bqgjb.lambda-url.us-east-1.on.aws/iiif/3/og-2023-kc-nara_A21343567_0024/full/max/0/default.jpg",
        "ocr_txt": true
    },
    "fields": {
        "sex": {
            "ms_sex_llm_v1": null
        },
        "doctype": {
            "ms_doctype_v1": "letter"
        },
        "form_title": {
            "ms_form_title_llm_v1": "LOI KHAI HUU TUE THE CUA NGUOI TY NAN XIN NHAP CANH HOA KY, NARA, 8/17/2023"
        },
        "is_g325a": false,
        "is_cert_naturalization": false,
        "countries": {
            "ms_countries_nlp_v1": []
        },
        "years": {
            "ms_years_nlp_v1": [
                2023
            ]
        },
        "certificate_naturalization": {
            "complexion": {
                "complexion_llm_v1": null
            },
            "marital_status": {
                "marital_status_llm_v1": null
            },
            "year_naturalization": {
                "year_naturalization_llm_v1": NaN
            },
            "residence_naturlization": {
                "residence_naturlization_llm_v1": null
            }
        },
        "g325a": {
            "occupation": {
                "occupation_llm_v1": null
            },
            "reason": {
                "reason_llm_v1": null
            },
            "nationality": {
                "nationality_llm_v1": null
            }
        }
    }
}